{
  "$schema": "https://json-schema.org/draft/2020-12/schema",
  "$id": "https://github.com/tt-a1i/archify/schemas/timeline.schema.json",
  "title": "Archify Event Timeline",
  "type": "object",
  "additionalProperties": false,
  "required": [
    "schema_version",
    "diagram_type",
    "meta",
    "events"
  ],
  "properties": {
    "schema_version": {
      "const": 1
    },
    "diagram_type": {
      "const": "timeline"
    },
    "meta": {
      "type": "object",
      "additionalProperties": false,
      "required": [
        "title",
        "evidence"
      ],
      "properties": {
        "title": {
          "type": "string",
          "minLength": 1
        },
        "locale": {
          "$ref": "common.schema.json#/$defs/locale"
        },
        "translations": {
          "$ref": "common.schema.json#/$defs/translations"
        },
        "subtitle": {
          "type": "string"
        },
        "output": {
          "type": "string"
        },
        "animation": {
          "$ref": "common.schema.json#/$defs/animation"
        },
        "visual_preset": {
          "$ref": "common.schema.json#/$defs/visualPreset"
        },
        "quality_profile": {
          "$ref": "common.schema.json#/$defs/qualityProfile"
        },
        "repository": {
          "$ref": "common.schema.json#/$defs/repository"
        },
        "views": {
          "$ref": "common.schema.json#/$defs/guidedViews"
        },
        "evidence": {
          "enum": [
            "observed",
            "illustrative"
          ],
          "description": "Whether the events are recorded observations or illustrative input; drawn on the canvas."
        },
        "timezone": {
          "type": "string",
          "minLength": 1,
          "description": "IANA time zone used for axis and event labels; defaults to UTC."
        },
        "input_contract": {
          "const": "phoenix-v1"
        }
      }
    },
    "layout": {
      "type": "object",
      "additionalProperties": false,
      "properties": {
        "width": {
          "type": "number",
          "minimum": 480,
          "description": "Drawing width of the time axis in px."
        },
        "breaks": {
          "enum": [
            "auto",
            "none"
          ],
          "description": "auto compresses long quiet periods into disclosed axis breaks."
        }
      }
    },
    "lanes": {
      "type": "array",
      "items": {
        "type": "object",
        "additionalProperties": false,
        "required": [
          "id",
          "label"
        ],
        "properties": {
          "id": {
            "$ref": "common.schema.json#/$defs/id"
          },
          "label": {
            "type": "string",
            "minLength": 1
          }
        }
      }
    },
    "events": {
      "type": "array",
      "minItems": 1,
      "items": {
        "type": "object",
        "additionalProperties": false,
        "required": [
          "id",
          "at",
          "title"
        ],
        "properties": {
          "id": {
            "$ref": "common.schema.json#/$defs/id"
          },
          "at": {
            "type": "string",
            "pattern": "^\\d{4}-\\d{2}-\\d{2}T\\d{2}:\\d{2}(:\\d{2}(\\.\\d{1,3})?)?(Z|[+-]\\d{2}:\\d{2})$",
            "description": "ISO 8601 timestamp with an explicit Z or ±HH:MM offset."
          },
          "title": {
            "type": "string",
            "minLength": 1
          },
          "detail": {
            "type": "string"
          },
          "lane": {
            "$ref": "common.schema.json#/$defs/id"
          },
          "kind": {
            "enum": [
              "default",
              "change",
              "alert",
              "action",
              "recovery"
            ]
          },
          "sources": {
            "$ref": "common.schema.json#/$defs/sourceReferences"
          },
          "precision": {
            "enum": [
              "day",
              "time"
            ],
            "description": "Recorded precision of at. day: the record has only a date and at is 12:00 at the authored offset; defaults to time."
          }
        }
      }
    },
    "cards": {
      "$ref": "common.schema.json#/$defs/cards"
    }
  }
}
